{
  "schema_version": "1.0.0",
  "package_id": "package.entitlement",
  "version": "1.0.0",
  "name": "Membership entitlements",
  "user_value": "Reusable membership grants, revocation, and history.",
  "availability": [{ "target": "web", "delivery_mode": "generated_source", "environments": ["test"], "visibility": "experimental", "readiness": "verified", "evidence_refs": ["artifacts/reviews/G2/entitlement.md"] }],
  "dependencies": [{ "package_id": "package.account", "version_range": "^1.0.0", "reason": "Entitlements require a verified user identity." }],
  "conflicts": [{ "package_id": "package.legacy-membership", "version_range": "*", "reason": "Both packages own membership state." }],
  "supported_targets": ["web"],
  "supported_delivery_modes": ["generated_source"],
  "required_permissions": ["entitlement.manage"],
  "backend_capabilities": ["entitlement.grant"],
  "migrations": ["platform/backend/migrations/000007_entitlement.up.sql"],
  "events": ["entitlement.granted.v1"],
  "audit_actions": ["entitlement.granted"],
  "admin_blocks": ["entitlement.grant-panel"],
  "client_blocks": ["entitlement.summary"],
  "hosted_routes": ["hosted.account"],
  "ui_template_compatibility": [{ "template_id": "standard-a", "version_range": "^1.0.0" }],
  "public_api_operations": ["getCurrentEntitlements"],
  "sdk_modules": ["sdk.entitlement"],
  "sdk_methods": ["getCurrentEntitlements"],
  "stable_errors": ["ENTITLEMENT_NOT_FOUND"],
  "config_schema_path": "contracts/entitlement/config.schema.json",
  "secret_refs": [],
  "provider_requirements": [],
  "generated_outputs": [{ "path": "src/generated/entitlement/routes.tsx", "ownership": "generated", "source_path": "content/entitlement.txt", "source_sha256": "sha256:aaaaaaaaaaaaaaaaaaaaaaaaaaaaaaaaaaaaaaaaaaaaaaaaaaaaaaaaaaaaaaaa", "render_strategy": "strict_template", "content_type": "text" }],
  "source_locations": ["platform/backend/internal/modules/entitlement"],
  "extension_points": ["entitlement.summary-slot"],
  "test_paths": ["platform/tests/entitlement/golden-flow.test.ts"],
  "smoke_tests": ["st.entitlement-check"],
  "documentation_paths": ["docs/packages/entitlement/README.md"],
  "upgrade_policy": { "strategy": "compatible", "guide_path": "docs/packages/entitlement/upgrade.md" },
  "rollback_policy": { "strategy": "compensating", "guide_path": "docs/packages/entitlement/rollback.md" },
  "data_retention": [{ "data_set": "entitlement.grant", "policy": "Retain grant history for audit.", "guide_path": "docs/packages/entitlement/data-retention.md" }],
  "content_files": [{ "path": "content/entitlement.txt", "sha256": "sha256:aaaaaaaaaaaaaaaaaaaaaaaaaaaaaaaaaaaaaaaaaaaaaaaaaaaaaaaaaaaaaaaa", "kind": "file" }],
  "content_tree_sha256": "sha256:bbbbbbbbbbbbbbbbbbbbbbbbbbbbbbbbbbbbbbbbbbbbbbbbbbbbbbbbbbbbbbbb",
  "manifest_sha256": "sha256:cccccccccccccccccccccccccccccccccccccccccccccccccccccccccccccccc"
}
